<?xml version="1.0"?><hint xmlns:xsi="http://www.w3.org/2001/XMLSchema-instance"xsi:noNamespaceSchemaLocation="../Ipat.xsd">    <interaction>        <name>            globalScore        </name>        <displaytype>            range        </displaytype>        <displayText>            Score        </displayText>        <range-min>            0        </range-min>        <range-max>            10        </range-max>        <default>            0        </default>        <ProfileVariablesAffected>            globalScore        </ProfileVariablesAffected>        <KernelAffected></KernelAffected>        <KernelVariableAffected></KernelVariableAffected>        <Effect>            setNewValue        </Effect>    </interaction>    <interaction>        <name>            FreezeBGColours        </name>        <displaytype>            checkbox        </displaytype>        <displayText>            Freeze Background        </displayText>        <range-min>0.0</range-min>        <range-max>1.0</range-max>        <default>            False        </default>        <ProfileVariablesAffected>            Page_bg_Red        </ProfileVariablesAffected>        <ProfileVariablesAffected>            Page_bg_Blue        </ProfileVariablesAffected>        <ProfileVariablesAffected>            Page_bg_Green        </ProfileVariablesAffected>        <Effect>            setRateOfEvolutionEqualZero        </Effect>    </interaction>    <interaction>        <name>            ChangeFontSize        </name>        <displaytype>            range        </displaytype>        <displayText>            Text Size        </displayText>        <range-min>            0        </range-min>        <range-max>            2        </range-max>        <default>            1        </default>        <KernelAffected>             h1        </KernelAffected>        <KernelAffected>             h2        </KernelAffected>        <KernelAffected>             p        </KernelAffected>        <KernelVariableAffected>            font-size        </KernelVariableAffected>        <Effect>            moderateByValue        </Effect>    </interaction>     <interaction>        <name>           ChangeFGContrast        </name>         <displaytype>            range        </displaytype>        <displayText>            Text Contrast        </displayText>        <range-min>            0        </range-min>        <range-max>            2        </range-max>        <default>            1        </default>        <KernelAffected>             h1        </KernelAffected>        <KernelAffected>             h2        </KernelAffected>        <KernelAffected>             p        </KernelAffected>        <KernelVariableAffected>            bold        </KernelVariableAffected>         <KernelVariableAffected>            italic        </KernelVariableAffected>        <Effect>            toggle        </Effect>    </interaction> </hint>