<?xml version="1.0"?><hint xmlns:xsi="http://www.w3.org/2001/XMLSchema-instance"xsi:noNamespaceSchemaLocation="../../Ipat.xsd">    <interaction>        <name>            globalScore        </name>        <displaytype>            range        </displaytype>        <displayText>            Score        </displayText>        <range-min>            0        </range-min>        <range-max>            10        </range-max>        <default>            0        </default>        <KernelAffected>         </KernelAffected>        <KernelVariableAffected>                    </KernelVariableAffected>        <ProfileVariablesAffected>            globalScore        </ProfileVariablesAffected>        <Effect>            setNewValue        </Effect>    </interaction><!--rest of the interactions are for CSS evolution and need rethinking for the UML design applicationbut they do give the right format for  an interactin so rather than delete they are just  commented out for now            <interaction>        <name>            FreezeBGColours        </name>        <displaytype>            checkbox        </displaytype>        <displayText>            Freeze Background        </displayText>        <default>            False        </default>        <KernelAffected>         </KernelAffected>        <KernelVariableAffected>                    </KernelVariableAffected>        <ProfileVariablesAffected>            Page_bg_Red        </ProfileVariablesAffected>        <ProfileVariablesAffected>            Page_bg_Blue        </ProfileVariablesAffected>        <ProfileVariablesAffected>            Page_bg_Green        </ProfileVariablesAffected>        <Effect>            setRateOfEvolutionEqualZero        </Effect>    </interaction>    <interaction>        <name>            ChangeFontSize        </name>        <displaytype>            range        </displaytype>        <displayText>            Text Size        </displayText>        <range-min>            0        </range-min>        <range-max>            2        </range-max>        <default>            1        </default>        <KernelAffected>             h1        </KernelAffected>        <KernelAffected>             h2        </KernelAffected>        <KernelAffected>             p        </KernelAffected>        <KernelVariableAffected>            fontsize        </KernelVariableAffected>        <ProfileVariablesAffected>                    </ProfileVariablesAffected>        <Effect>            moderateByNewValue        </Effect>    </interaction>   --></hint>